K1.40;PD00129;Zespół klasztorny jezuitów w Drohiczynie;Dawny klasztor jezuitów wybudowany w latach 1729-1744.;;area;no;no;yes;Q56328171;pl:Wyższe Seminarium Duchowne w Drohiczynie;2024-10-14;22.65410381407278;52.39435072791432;Point (748528.36660376680083573 509440.55007796036079526)
K1.40;WN00663;Zespół klasztorny Jezuitów w Świętej Lipce;Sanktuarium maryjne. Budowa obecnego barokowego kościoła nastąpiła z inicjatywy jezuitów w latach 1688–1693. Kościół jest otoczony przez czworoboczny krużganek odpustowy z czterema kaplicami narożnymi. ;;area;no;yes;yes;Q9167726;pl:Bazylika Nawiedzenia Najświętszej Maryi Panny w Świętej Lipce;2024-10-14;21.21723509950895;54.02445925777468;Point (645198.73494104936253279 686720.50682888296432793)
K1.40;MA00783;Zespół klasztorny Kamedułów na Srebrnej Górze;Zabytkowy kościół rzymskokatolicki wraz z eremem oo. kamedułów.;;area;no;no;yes;Q5024910;pl:Kościół Wniebowzięcia Najświętszej Maryi Panny w Krakowie (Bielany);2024-10-14;19.841347553599697;50.0456946564064;Point (560221.29311659606173635 242386.43160605619777925)
K1.40;WP00035;Zespół klasztorny Kamedułów w Bieniszewie;Zespół klasztorny Eremu Pięciu Męczenników otoczony jest murem, poza który wstęp mają tylko mężczyźni (z wyjątkiem niedzielnej mszy świętej o 10.30, w której uczestniczyć mogą również kobiety).;;area;no;no;yes;Q4904561;pl:Bieniszew-Klasztor;2024-10-14;18.183054842774084;52.284524296356075;Point (444289.72717303148237988 491260.27527995122363791)
K1.40;PD00724;Zespół klasztorny Kamedułów w Wigrach;Osada Wigry założona około 1422 r., oddana w 1667 r. przez Jana Kazimierza Kamedułom, którzy zbudowali drewniany, a po pożarze w 1671r. murowany zespół klasztorny z kościołem, eremami, refektarzem, wieżą zegarową, szpitalem oraz domami: królewskim, kanclerskim i domkiem furtiana. Zespół klasztorny zniszczony w czasie I i II wojny światowej. Zachował się częściowo kościoła, fragment jadalni, erem. Całość została zrekonstruowana.;;area;no;no;yes;Q48862789;pl:Kościół Niepokalanego Poczęcia Najświętszej Maryi Panny w Wigrach;2024-10-14;23.08680357998265;54.068923733747724;Point (767294.55932645651046187 697116.61169481533579528)
K1.40;WP00784;Zespół klasztorny Kongregacji Oratorium św. Filipa Neri w Gostyniu;Zespół klasztorny filipinów wraz z barokowym kościołem pw. Niepokalanego Poczęcia NMP i św. Filipa Neri zbudowany na wzór weneckiej bazyliki Santa Maria della Salute.;;area;no;yes;yes;Q9167784;pl:Bazylika na Świętej Górze;2024-10-14;17.03564530450472;51.88521671227827;Point (364848.20377108978573233 448369.76240010018227622)
K1.40;SK00662;Zespół klasztorny w Świętej Katarzynie;Założony w drugiej połowie XV w., początkowo jako klasztor bernardynów. Wielokrotnie przebudowywany i obecnie w zasadzie bezstylowy. Wyjątkiem jest otoczony krużgankami renesansowy wirydarz z 1633 r.;;area;no;no;yes;brak;brak;2024-10-14;20.882169802354593;50.902467419724466;Point (632303.22951553319580853 338973.36410279321717098)
K1.40;LU00312;Zespół kościelno-klasztorny w Krasnobrodzie-Podklasztorzu;Rzymskokatolicki kościół parafialny, pochodzący z końca XVII wieku, będący częścią podominikańskiego zespołu klasztornego.;;area;no;no;yes;Q11745571;pl:Kościół Nawiedzenia Najświętszej Maryi Panny w Krasnobrodzie;2024-10-14;23.228068300961198;50.53926977145408;Point (799468.29554780421312898 305449.59767524746712297)
K1.20;MZ00562;Zespół pałacowo-parkowy w Radziejowicach;Obiekt wybudowany w stylu klasycystycznym wraz z otaczającym go parkiem. Od 1965 r. pełni funkcję domu pracy twórczej dla twórców kultury. Pałac mieści także sale muzealne i galerię wystaw czasowych.;;area;no;no;yes;Q9390562;pl:Zespół pałacowo-parkowy w Radziejowicach;2024-10-14;20.553141153546857;52.0024609366379;Point (606582.9934720202581957 460721.35759337345371023)
K1.20;WP00836;Zespół pałacowo-parkowy w Turwi;Barokowy pałac rodziny Chłapowskich. Pochodzi z lat 1760–1770. Wybudowany został przez Ludwika Chłapowskiego jako dwupiętrowy pałac, a później przebudowany w latach 1780, 1820–1830 i w początkach XX wieku.;;area;no;no;yes;Q11815051;pl:Pałac w Turwi;2024-10-14;16.818270470824196;52.06011956645849;Point (350477.48345288645941764 468239.52059227239806205)
K1.20;LD00703;Zespół pałacowo-parkowy w Walewicach;Klasycystyczny obiekt zaprojektowany przez Hilarego Szpilowskiego lub Stanisława Zawadzkiego zbudowany w latach 1773–1783 przez Anastazego Walewskiego (szambelana króla Stanisława Augusta Poniatowskiego).;;area;no;no;yes;Q39331424;pl:Pałac w Walewicach;2024-10-14;19.665643960001034;52.0941422740383;Point (545586.96374747774098068 469985.86548365082126111)
K1.20;LD00739;Zespół pałacowo-parkowy w Wolborzu;Obecny pałac w stylu barokowym wzniesiony został w latach 1768–1773, gdy Wolbórz był pod rządami biskupa Ostrowskiego, z wykorzystaniem murów istniejących budowli (z początku XVII w.) według projektu architekta włoskiego Franciszka Placidiego z przeznaczeniem na letnią rezydencję Biskupów Kujawskich;;area;no;no;yes;Q11814732;pl:Pałac Biskupów Kujawskich w Wolborzu;2024-10-14;19.840897969727976;51.497444293704596;Point (558354.30934796412475407 403767.83444583654636517)
K1.20;WP00506;Zespół pałacowy w Pawłowicach;Dawna rezydencja szlachecka wybudowana pod koniec XVIII w. w stylu klasycyzującego baroku według projektu Carla Gottharda Langhansa. Jej fundatorem był pisarz wielki koronny Maksymilian Mielżyński (1738–1799) herbu Nowina. Obecnie mieści się w nim Zakład Doświadczalny Pawłowice Instytutu Zootechniki z Krakowa. Obiekt pełni także funkcję ośrodka konferencyjno-hotelowego.;;area;no;no;yes;Q7156392;pl:Pałac w Pawłowicach (powiat leszczyński);2024-10-14;16.750542908467285;51.82282316473973;Point (345020.5240504412795417 442001.40042327024275437)
K1.20;LB00161;Zespół pocysterski w Gościkowie-Paradyżu;Pocysterski barokowy zespół klasztorny z kościołem Wniebowzięcia Najświętszej Marii Panny i św. Marcina. Jest to największe i najlepiej zachowane założenie klasztorne w województwie lubuskim, obecnie siedziba Wyższego Seminarium Duchownego Diecezji Zielonogórsko-Gorzowskiej.;;area;no;yes;yes;Q579776;pl:Opactwo cystersów w Gościkowie-Paradyżu;2024-10-14;15.542839443788429;52.33773381307935;Point (264561.10337887518107891 502488.68923357967287302)
K1.20;PM00809;Zespół poklasztorny Norbertanek w Żukowie;Gotycki kościół z XIV wieku przebudowany w XV i XVII wieku. Część dawnego klasztoru norbertanek w Żukowie;;area;no;no;yes;Q11745843;pl:Kościół Wniebowzięcia Najświętszej Marii Panny w Żukowie;2024-10-14;18.362454709465805;54.340462426729914;Point (458563.65543753997189924 719782.92290005297400057)
K1.10;LB00890;Zespół Willowo-Ogrodowy w Gorzowie Wielkopolskim;Muzeum znajduje się w zabytkowej willi otoczonej 4 ha. ogrodem. W muzeum prezentowane są wystawy stałe: Konwisarstwo, Skarbczyk, Gabinet rycin, Dawna sztuka zdobnicza, Wnętrza w stylu biedermeier, Henryk Rodakowski „Album Pałahickie” - cykl jedenastu akwarel przedstawiających chłopów i Żydów z Pałahicz w Sali Henryka Rodakowskiego, Sala portretowa, Sień herbowa.;o. Muzeum Lubuskie w Gorzowie Wielkopolskim. W KKP obiekt Muzeum było potraktowane jako jeden obiekt, w CKKP zostały wprowadzone poszczególne oddziały.;area;no;no;yes;Q11787055;pl:Muzeum Lubuskie im. Jana Dekerta w Gorzowie Wielkopolskim;2024-10-14;15.249575681617522;52.735169361621594;Point (246894.45309575949795544 547654.13634602073580027)
K1.20;PK00311;Zespół zamkowo-parkowy w Krasiczynie;Obiekt wybudowany w stylu renesansowo-manierystycznym, pierwotnie zbudowany na przełomie XVI i XVII w. Budowę zamku rozpoczął kasztelan przemyski Stanisław Sieciński. Charakterystyczne dla niego są cztery odmienne wieże narożne: Boska, Papieska, Królewska i Szlachecka. Zamek jest otoczony parkiem.;;area;no;yes;yes;Q2969507;pl:Zamek w Krasiczynie;2024-10-14;22.64902262592536;49.775304705794895;Point (762623.36805234360508621 218382.9894827542884741)
K1.10;PM00844;Żuraw Gdański;Zabytkowy dźwig portowy i jedna z bram wodnych Gdańska, która mieści się nad Motławą, na końcu ulicy Szerokiej. Największy i najstarszy z zachowanych dźwigów portowych średniowiecznej Europy;o. Narodowego Muzeum Morskiego w Gdańsku W KKP Narodowe Muzeum Morskie w Gdańsku było oznaczone jako jeden obiekt, w CKKP zostało rozdzielone na poszczególne obiekty.;area;no;no;yes;Q253930;pl:Brama Żuraw w Gdańsku;2024-10-14;18.657464115860385;54.35056314425359;Point (477742.72341983357910067 720773.21141533018089831)
K1.20;WN00617;Wiadukty kolejowe w Stańczykach;Dwa mosty kolejowe z lat 1917–1918, należą do najwyższych w Polsce. Posiadają konstrukcję 5-przęsłowa, długości 180 m, wysokości do 36,5 m.;;area;no;no;yes;Q539179;pl:Mosty w Stańczykach;2024-10-14;22.654623536395217;54.297494675092885;Point (737724.83785109035670757 720976.45104285178240389)
K1.10;KP00673;Tężnie z warzelnią soli w Ciechocinku;Zespół trzech tężni solankowych, wzniesionych w XIX wieku i zaprojektowane przez profesora Jakuba Graffa. Jest to największa tego typu drewniana konstrukcja w Europie.;;area;no;yes;yes;Q9363872;pl:Tężnie w Ciechocinku;2024-10-14;18.78387181311766;52.886330085531775;Point (485461.866269160003867 557889.08304735622368753)
K1.30;LB00279;Ruiny Starego Miasta i Twierdzy w Kostrzynie nad Odrą;Kostrzyńska Starówka stanowi obecnie zarośnięte pole z resztkami ruin dawnej zabudowy na skutek zniszczeń po zaciętych walkach w 1945 roku. Kostrzyn został zniszczony w blisko 100% i jest uznawany za najbardziej zniszczone wojną miasto na terenie dzisiejszej Polski, nazywane czasem „polską Hiroszimą”.;;area;no;no;yes;Q123467947;pl:Stary Kostrzyn;2024-10-14;14.635875226111194;52.57894712243086;Point (204444.24452345253666863 532632.17046978324651718)
P.3.00;SK00744;Rezerwat „Wykus” i symboliczny cmentarz partyzancki;"Leśny rezerwat przyrody o powierzchni: 63,58 ha. Przedmiotem ochrony jest fragment rzeki Lubianki i jej dopływu wraz ze zboczem wzniesienia Wykus; lasy i bory mieszane o cechach lasu naturalnego. W centrum rezerwatu znajduje się niewielka polana z pomnikiem w formie kapliczki upamiętniającym znajdujące się tu miejsce obozowania partyzantów AK ze zgrupowania „Ponurego”.";;area;no;no;yes;Q9309600;pl:Rezerwat przyrody Wykus;2024-10-14;20.973807735879856;51.01597819486265;Point (638406.48525233496911824 351759.04153405991382897)
P1.20;PK00535;Połonina Wetlińska;Masyw górski i połonina w Bieszczadach Zachodnich. Jest jednym z najczęściej odwiedzanych miejsc w Bieszczadach.;;area;no;no;yes;Q11826253;pl:Połonina Wetlińska;2024-10-14;22.534302650993222;49.164003543197246;Point (757557.10862821701448411 150066.83543177653336897)
P1.20;MA00125;Dolina Kościeliska;Dolina walna, tj. sięgająca od podnóża Tatr do głównego grzbietu – grani głównej Tatr. Jest orograficznie prawą odnogą doliny Czarnego Dunajca, do której uchodzi w Kirach. Jest drugą co do wielkości doliną polskich Tatr i najbardziej atrakcyjną pod względem ilości wapiennych form skalnych, wąwozów, jaskiń, a także historii.;;area;no;no;yes;Q11694533;pl:Dolina Kościeliska;2024-10-14;19.86754891762442;49.25968800528624;Point (563104.87037198606412858 155049.1597057203471195)
P1.20;MA00127;Dolina Strążyska;Dolina w polskich Tatrach Zachodnich, położona pomiędzy Doliną ku Dziurze a Doliną za Bramką. Ma powierzchnię ok. 4 km² i długość 3 km. Prowadzi tędy szlak turystyczny na Giewont.;;area;no;no;yes;Q9208975;pl:Dolina Strążyska;2024-10-14;19.93252717298652;49.26917252644432;Point (567818.28126503014937043 156159.47904582397313789)
P1.20;MA00182;Hala Gąsienicowa;Nazwa północnej części Doliny Gąsienicowej w Tatrach obejmującej Rówienki i otoczenie schroniska „Murowaniec”.;;area;no;no;yes;Q9285065;pl:Hala Gąsienicowa;2024-10-14;20.00783979987732;49.24482372175051;Point (573331.39813681412488222 153523.77609631902305409)
P1.20;DS00232;Kocioł Wielkiego Stawu;Kocioł polodowcowy w Sudetach Zachodnich, w Karkonoszach.;;area;no;no;yes;Q11740700;pl:Kocioł Wielkiego Stawu;2024-10-14;15.692039579806897;50.75794460737384;Point (266771.92109455319587141 326437.38250266696559265)
P1.20;DS00862;Kocioł Małego Stawu;Kościoł polodowcowy w Karkonoszach w Sudetach Zachodnich. Znajduje się w środkowo-wschodniej części Karkonoszy, u wschodniego krańca Śląskiego Grzbietu. Podcina on północno-wschodnie zbocza Smogorni (1489 m n.p.m.) i Równi pod Śnieżką (1400 m n.p.m.). Jego ściany są wysokie na około 200 m. Dno znajduje się na wysokości 1183 m n.p.m. Na dnie kotła powstało jezioro cyrkowe Mały Staw.;;area;no;no;yes;Q11740698;pl:Kocioł Małego Stawu;2024-10-14;15.69989605740035;50.7502263741674;Point (267287.41863013961119577 325554.90243956900667399)
P1.20;MA00715;Wąwóz Szopczański;Wąwóz na terenie południowej Polski, położony w Pieninach Środkowych.;;area;no;no;yes;Q9381346;pl:Wąwóz Szopczański;2024-10-14;20.40617070478929;49.41289851468616;Point (601965.84463772422168404 172665.03625108738197014)
P1.20;SK00714;Wąwóz Królowej Jadwigi;Około półkilometrowy wąwóz lessowy położony w południowo-zachodniej części miasta między ulicami Staromiejską a Królowej Jadwigi.;;area;no;no;yes;Q4330756;pl:Wąwóz Świętej Królowej Jadwigi w Sandomierzu;2024-10-14;21.741971014521138;50.67671793226536;Point (693664.30082042457070202 315776.91828269953839481)
K1.20;ZP00706;Wały Chrobrego;Taras widokowy o długości ok. 500 m w Szczecinie na skarpie wzdłuż Odry. Zaprojektowany i wzniesiony według koncepcji Wilhelma Meyera-Schwartau w latach 1902–1921 z inicjatywy nadburmistrza Hermanna Hakena, na cześć którego został pierwotnie nazwany.;;area;no;no;yes;Q549934;pl:Wały Chrobrego;2024-10-14;14.565863496105932;53.42978277736406;Point (205560.55463402063469402 627463.49207577004563063)
P1.20;DS00606;Skalne Grzyby;Skupisko skał w Górach Stołowych, w Sudetach Środkowych, w południowo-zachodniej Polsce.;;area;no;no;yes;Q9337558;pl:Skalne Grzyby;2024-10-14;16.416750808212146;50.46016359168791;Point (316705.91096858138917014 291305.7427691129851155)
K1.20;DS00886;Pawilon Czterech Kopuł;Pawilon wybudowany na początku XX wieku na terenach Wystawy Stulecia we wschodniej części Wrocławia. Obecnie mieści sie w nim ekspozycję sztuki współczesnej Muzeum Narodowego w Wrocławiu.;o. Muzeum Narodowego we Wrocławiu;area;yes;no;yes;Q11814615;pl:Pawilon Czterech Kopuł;2024-10-14;17.076077626948145;51.10829671236525;Point (365359.40659357339609414 361928.5108746646437794)
P.3.00;PM00504;Park Narodowy „Bory Tucholskie”;Został utworzony w 1996 roku. Zajmuje powierzchnię 4613,04 ha. Powierzchnia leśna parku obejmuje jedynie 1,9% całkowitej powierzchni leśnej Borów Tucholskich. Stanowi to obszar o powierzchni 3800 ha, zajmujący blisko 83% powierzchni parku. Dominują siedliska borowe, zajmujące 98% spośród wszystkich siedlisk leśnych.;;area;no;no;yes;Q1619225;pl:Park Narodowy „Bory Tucholskie”;2024-10-14;17.56567050343139;53.814822408596335;Point (405594.90874464088119566 662083.25827040430158377)
K1.40;WP00447;Opactwo Cystersów w Obrze;Kościół i klasztor pocysterski. Późnobarokowy kościół pw. św. Jakuba został zbudowany w latach 1722-1757. Wyposażenie wnętrza jest utrzymane w stylach rokokowym i wczesnoklasycystycznym. Klasztor w stylu późnego baroku, przybudowany do kościoła, pochodzi z 1618 roku.;;area;no;no;yes;Q17024529;pl:Opactwo Cystersów w Obrze;2024-10-14;16.05760748739155;52.070982776828146;Point (298404.9282612691167742 471286.38083598704542965)
K1.40;MA00375;Dawny zespół klasztorny Bożogrobowców w Miechowie;Zespół obiektów stanowiących dawniej założenie klasztorne zakonu bożogrobców w Miechowie. Składają się na niego bazylika kolegiacka Grobu Bożego, klasztor, zamek generałów zakonu i baszta. Kompleks, ufundowany w 1163 roku przez możnowładcę Jaksę Gryfitę, należał od XII wieku do 1819 roku do zakonu Kanoników Regularnych Grobu Bożego. Pierwotnie całe założenie było otoczone murem obronnym wzniesionym w latach 80. XIV wieku.;;area;no;no;yes;Q9390526;pl:Zespół klasztorny bożogrobców w Miechowie;2024-10-14;20.02591845313455;50.35773941265922;Point (572954.93345957470592111 277235.82672341505531222)
K1.20;ZP00176;Grodzisko nad jeziorem Czajczym;Pozostałości grodziska znajdujące się na wyspie Wolin, na półwyspie rozdzielającym jezioro Czajcze na dwie części. W XIV wieku było to miejsce schronienia dla mieszkańców okolicznych osad. Dziś znajdują się tu jedynie pozostałości obwarowań. ;;area;no;no;yes;brak;brak;2024-10-14;14.560720248960857;53.94332117151044;Point (208789.09931746573420241 684549.82639118272345513)
K1.10;WN00468;Planetarium i obserwatorium astronomiczne w Olsztynie;Drugie co do wielkości planetarium w Polsce. Planetarium otwarto 19 lutego 1973 r., w pięćsetną rocznicę urodzin Mikołaja Kopernika pod nazwą Planetarium Lotów Kosmicznych.;;area;no;no;yes;Q11819388;pl:Planetarium w Olsztynie;2024-10-14;20.491225187915187;53.774979539513915;Point (598242.69423057942185551 657729.43269560043700039)
K1.20;PM00143;Port morski w Gdyni;Handlowy port morski nad Zatoką Gdańską, w woj. pomorskim w Gdyni, położony na Pobrzeżu Kaszubskim. Jest trzecim co do wielkości portem morskim w Polsce.;;area;no;no;yes;Q4352784;pl:Port morski Gdynia;2024-10-14;18.526772596689636;54.532183019779815;Point (469386.45673733548028395 741024.65334929618984461)
K1.10;PM00065;Spichlerze na Ołowiance;"Sedziba Muzeum, w głównym budynku można zwiedzić trzy wystawy stałe: „Polacy na morzach świata”, „Archeologia Morska i Nurkowanie”, „Galerię Morską” (ekspozycja malarstwa marynistycznego) oraz wystawy czasowe; oprócz wystaw znajdują się tam m.in. archiwum, biblioteka z czytelnią i sala konferencyjna.";o. Muzeum Narodowego w Gdańsku W KKP wszyskie oddziały muzeum potraktowano jako jeden. W CKKP zostały rozdzielone na poszczególne obiekty.;area;no;no;yes;Q4845346;pl:Narodowe Muzeum Morskie w Gdańsku;2024-10-14;18.659004411448134;54.35107507055027;Point (477843.08366817340720445 720829.66937560145743191)
K1.40;LU00769;Zespól klasztorny Dominikanów w Lublinie;Jedna z najstarszych świątyń Lublina, wraz z klasztorem jest jedną z najdłużej istniejących instytucji tego miasta (w 2003 r. obchodziła jubileusz 750 lat).;;area;no;no;yes;Q9167815;pl:Bazylika św. Stanisława Biskupa Męczennika w Lublinie;2024-10-14;22.57026044697593;51.24745831268408;Point (749079.18437244044616818 381695.40563749324064702)
K1.10;LU00876;Muzeum Narodowe w Lublinie - Zamek Królewski;Muzeum w Lublinie, należy do najstarszych i największych muzeów we wschodniej Polsce. Zbiory liczą obecnie ok. 157 000 eksponatów. Oglądać je można na tematycznych wystawach. Mieści się na zamku w Lublinie, pierwotnie zbudowanym w XII wieku, wielokrotnie przebudowywanym. W XVI w. był rezydencją królewską, w XVII w. zniszczony. W XIX w. odbudowany jako więzienie (1831–1954).;W KKP Muzeum Narodowe oraz Kapica św. Trójcy były traktowane jako jeden budynek. W CKKP zostały rozdzielone.;area;no;no;yes;Q6695405;pl:Muzeum Narodowe w Lublinie;2024-10-14;22.572355926627036;51.25047504533004;Point (749209.01211050187703222 382037.76380905194673687)
K1.20;LU00240;Katolicki Uniwersytet Lubelski;Polski uniwersytet katolicki z siedzibą w Lublinie. Jest kościelną szkołą wyższą o pełnych prawach publicznych szkół wyższych. Najstarsza uczelnia Lublina i jeden z najstarszych uniwersytetów funkcjonujących w Polsce, powstały 1918r.;W CKKP oznaczono wyłacznie gmach główny będący podominikańskim kompleksem, który uniwersytet otrzymał jeszcze przed wojną.;area;no;no;yes;Q175529;pl:Katolicki Uniwersytet Lubelski Jana Pawła II;2024-10-14;22.54480810431689;51.2476165078141;Point (747303.14507671189494431 381626.91677811654517427)
K1.30;SK00830;Ruiny walcowni z urządzeniami wodnymi w Nietulisku;Zakład walcowni powstał w latach 1834–1846 w ramach działalności inwestycyjnej Banku Polskiego i projektu Karola Knake. Dziś walcownia żelaza w Nietulisku Dużym jest zabytkiem techniki, w stanie trwałej ruiny. Szczególną wartość posiada kompletnie zachowany historyczny układ wodny. ;;area;no;no;yes;Q7031936;pl:Nietulisko Duże;2024-10-14;21.25568689156698;50.979203599056824;Point (658295.4253548476845026 348238.74403507047099993)
K1.10;SK00320;Muzeum Archeologiczne i Rezerwat Krzemionki;Rezerwat archeologiczny chroniący zespół neolitycznych kopalń krzemienia pasiastego.;;area;yes;yes;yes;Q1434086;pl:Krzemionki;2024-10-14;21.501108918876536;50.97045125569167;Point (675549.05961456941440701 347821.63317965535679832)
K1.20;LD00044;Stado Ogierów w Bogusławicach;Jednostka hodowli koni grupująca ogiery rozrodowe różnych ras. Mieści się w budynkach i na terenie będącym wcześniej częścią majątku biskupów kujawskich, w osadzie Bogusławice.;;area;no;no;yes;Q9341282;pl:Stado Ogierów w Bogusławicach;2024-10-14;19.83240732056606;51.51175271559698;Point (557747.01870758121367544 405351.87416236358694732)
K1.20;LB00047;Fortyfikacje Międzyrzeckiego Rejonu Umocnionego w Boryszynie;Międzyrzecki Rejon Umocniony, MRU – system umocnień stworzony przez Niemców w latach 1934–1944 dla ochrony wschodniej granicy Rzeszy. Zlokalizowany w województwie lubuskim, nieopodal Międzyrzecza. Składa się z trzech odcinków różniących się pod względem charakterystyki geograficznej otoczenia i nasyceniem obiektami fortyfikacyjnymi. Międzyrzecki Rejon Umocniony to jedne z największych podziemi fortyfikacyjnych świata. Podziemia odcinka centralnego MRU są obecnie rezerwatem nietoperzy, w którym zimuje ponad 30 tys. osobników należących do 12 gatunków nietoperzy. Łączną długość podziemnych korytarzy szacuje się na około 32–35 km.;Ze względu na dużo powierzchnie jaką zajmuje MRU w CKKP został dodany jako obszar na którym znajduje sie najbardzie popularna częć kompleksu.;area;no;no;yes;Q313960;pl:Międzyrzecki Rejon Umocniony;2024-10-14;15.48932019458898;52.387806547483436;Point (261187.86761893911170773 508229.54106077231699601)
K1.20;PD00912;Dyrekcja Parku w Kurowie;Dyrekcja mieści się w zbudowanym w 1920 r dworze szlacheckim. Dwór jest otoczony jest dziewiętnastowiecznym parkiem. Rosną w nim okazy dębu bezszypułkowego, jodły kanadyjskiej, klonu czerwonolistnego, wiązy, świerki i lipy. W pobliżu znajduje się drewniana wieża widokowa i pole biwakowe. ;;area;no;no;yes;Q30580154;pl:Dwór w Kurowie;2024-10-14;22.79428663827465;53.10440711859245;Point (753893.28445258608553559 588846.58134028362110257)
K1.10;PD00328;Ośrodek edukacyjny w Kurowie;Ośrodek miesci się w pochodzącym z 1925 roku domu młynarza. Składa się z wyremontowanego zabytkowego budynku oraz dobudowanej części ekspozycyjnej. W ośrodku znajdują się m.in. pracownie edukacyjne, punkt informacji turystycznej, sala konferencyjno-kinowa oraz ekspozycja przyrodnicza.;;area;no;no;yes;brak;brak;2024-10-14;22.783836249325173;53.11004435135266;Point (753161.14547663065604866 589436.09564347949344665)
K1.30;DS00112;Zamek Czocha;Obronny zamek graniczny, Powstał jako warownia graniczna na pograniczu śląsko-łużyckim w latach 1241–1247. Dostępny jako ośrodek hotelowo-konferencyjny.;;area;no;no;yes;Q1014312;pl:Zamek Czocha;2024-10-14;15.3035828857632;51.03068308866939;Point (240910.28824574511963874 358042.2231312119984068)
K1.10;WN00135;Muzeum Archeologiczno-Historyczne w Elblągu;Muzeum powstałe w 1954 roku z siedzibą na terenie Podzamcza dawnego Zamku Krzyżackiego. Muzeum mieści się w dwóch budynkach: dawnej Słodowni, popularnie zwanej Podzamczem oraz w dawnym Gimnazjum. Główną część jego zbiorów stanowią eksponaty z Elbląga, Żuław, Pomorza i krajów północnoeuropejskich.;"Obiekt występował pod nazwą ""Muzeum Okrękowe"" zmieniona na prawidłową";area;no;no;yes;Q15284137;pl:Muzeum Archeologiczno-Historyczne w Elblągu;2024-10-14;19.394167412536323;54.15660618255059;Point (525732.63136610540095717 699216.71695389458909631)
K1.10;LB00160;Muzeum Grodu Santok w Gorzowe Wielkopolskim;Muzeum mieści wystawę archeologiczną, na której pokazano jego historię w oparciu o zabytki z badań wykopaliskowych z lat 1958–1965 oraz zbiór zabytków poniemieckich.;o. Muzeum Lubuskiego w Gorzowie Wielkopolskim. W KKP obiekt Muzeum było potraktowane jako jeden obiekt, w CKKP zostały wprowadzone poszczególne oddziały.;area;no;no;yes;Q11787055;pl:Muzeum Lubuskie im. Jana Dekerta w Gorzowie Wielkopolskim;2024-10-14;15.396897872523287;52.734292733022656;Point (256828.35581374340108596 547048.42315121367573738)
K1.10;MZ00172;Ośrodek Dydaktyczno-Muzealny w Granicy;Niewielki skansen (trzy zagrody) we wsi Granica k. Kampinosu. Reprezentuje w dużej mierze zanikłe drewniane budownictwo ludowe Puszczy Kampinoskiej wraz z ośrodkiem muzealno - dydaktycznym.;;area;no;no;yes;Q9337632;pl:Skansen budownictwa puszczańskiego w Granicy;2024-10-14;20.451686585894134;52.286639743727264;Point (598988.92281963001005352 492173.4387067262432538)
K1.10;DS00212;Muzeum Karkonowskie w Jeleniej Górze;W zbiorach muzeum znajduje się malarstwo, rzeźba, dzieła sztuki użytkowej, szkło artystyczne, wystawa etnograficzna (w tym zachowana w całości przysłupowa chałupa wiejska z wyposażeniem) oraz dzieje Jeleniej Góry i okolic.;"Obiekt występował pod nazwą ""Muzeum Okrękowe"" zmieniona na prawidłową.";area;no;no;yes;brak;brak;2024-10-14;15.738146176294958;50.897298546190136;Point (270706.20380457653664052 341779.41968053561868146)
