otype;idckkp;name;desc;mdesc;gtype;wh;ph;kkp;wikidata;wikipedia;published;x_wgs84;y_wgs84;wkt_2180
K1.20;OP00059;Mury miejskie w Byczynie;Ciąg murów miejskich wokół Starego Miasta w Byczynie, wzniesionych z cegły w XIII wieku. ;;line;no;no;yes;brak;pl:Mury obronne w Byczynie;2024-10-14;18.2146361;51.115086299999994;Point (445044.63441754947416484 361216.76880231220275164)
K1.20;ZP00705;Most Kłosowski w Wałczu;Most wiszący o konstrukcji stalowej, długości 85 m wybudowany został w 1978 roku w miejscu wcześniejszego mostka drewnianego. Mostem tym można dojść do umocnień Wału Pomorskiego;Zmieniono nazwę na poprawną;line;no;no;yes;Q11785795;pl:Most Kłosowski;2024-10-14;16.4307331;53.26429869999999;Point (328698.05398693692404777 602979.92281894572079182)
S3.10;DS00887;Ścieżka przyrodnicza na Górę Chojnik;Ścieżka na 21 stacjach, opis budowy geologicznej i morfologii oraz roślinności.;;line;no;no;yes;brak;brak;2024-10-14;15.642982602230498;50.84678779170618;Point (263762.74974809587001801 336466.31636993400752544)
K1.20;LD00359;Ulica Piotrkowska na odcinku od pl. Wolności do Al. Mickiewicza w Łodzi;Reprezentacyjna ulica Łodzi, jedna z najdłuższych ulic handlowych na kontynencie licząca ok. 4,2 km, biegnąca południkowo w linii prostej, pomiędzy pl. Wolności a pl. Niepodległości. Od 1990 r. zamieniona w rodzaj deptaka, który pełni rolę podobną do rynku starówki innych miast.;;line;no;no;yes;Q1095484;pl:Ulica Piotrkowska w Łodzi;2024-10-14;19.458482436730613;51.75952413814717;Point (531633.86761630501132458 432670.785667241550982)
S3.10;PD00642;Szlak Dębów Królewskich;Ścieżka biegnie przez uroczysko Stara Białowieża, wśród dębów liczących 150-500 lat. Poszczególne drzewa noszą imiona królów i książąt, którzy niegdyś polowali w tym lesie.;;line;no;no;yes;brak;brak;2024-10-14;23.789774536321815;52.731076058350084;Point (823239.69493887270800769 551365.20547011680901051)
S3.10;PM00643;Szlak Struga Siedmiu Jezior (Klosnowo-Bachorze);Szlak prowadzi wzdłuż rzeki, łącząc osiem jezior rynnowych o najwyższej klasie czystości: Ostrowite, Zielone, Jeleń, Bełczak, Główka, Płęsno, Skrzynka i Mielnica.;;line;no;no;yes;brak;brak;2024-10-14;17.5590585;53.69533739999999;Point (404890.16857390466611832 648803.91052038036286831)
S3.10;PD00651;Ścieżka edukacyjna „Czerwone Bagno”;Zielono znakowana ścieżka dydaktyczna prowadząca przez obszar ochrony ścisłej Czerwone Bagno w Biebrzańskim Parku Narodowym. Długość 1 km.;;line;no;no;yes;brak;pl:Ścieżka przyrodnicza Czerwone Bagno;2024-10-14;22.822833408348565;53.620750001333526;Point (752725.61840000003576279 646336.57829999923706055)
S3.10;PD00652;Ścieżka edukacyjna „Grobla Honczarowska”;Zielono znakowana ścieżka dydaktyczna w Biebrzańskim Parku Narodowym.;;line;no;no;yes;Q127700722;pl:Ścieżka przyrodnicza Grobla Honczarowska;2024-10-14;22.6023668907262;53.314434084232055;Point (739878.93540000007487833 611527.50439999904483557)
S3.10;PD00653;Ścieżka edukacyjna „Waniewo-Śliwno”;Ścieżka przyrodnicza o długości 1,2 km prowadząca drewnianą kładką z jednej strony doliny na drugą. Biegnie przez niedostępny, bagienny teren, dzięki czemu można dotrzeć do serca parku bez konieczności korzystania z łodzi czy kajaka. Największą atrakcją są przeprawy przez licznie występujące tu koryta rzeczne za pomocą pływających pomostów. Przy kładce zlokalizowane są 2 dostrzegalnie ornitologiczne i wieża widokowa.;;line;no;no;yes;brak;brak;2024-10-14;22.818810695068557;53.07691056318024;Point (755696.731091812485829 585877.86472725309431553)
S3.10;LB00654;Ścieżka przyrodnicza „Ptasim Szlakiem”;Ścieżka przyrodnicza „Ptasim szlakiem” o długości około 2 km, prowadzi przez jedne z najbardziej atrakcyjnych w parku terenów lęgowych ptaków. Najlepszym terminem korzystania ze ścieżki jest wiosna i jesień. Turyście na ścieżce przyda się: lornetka, luneta i atlas ptaków.;;line;no;no;yes;brak;brak;2024-10-14;14.774457200000002;52.584357;Point (213860.30049110850086436 532673.81670151744037867)
S3.10;LU00655;Ścieżka przyrodnicza na „Bukową Górę”;Ścieżka poświęcona niezwykłej różnorodności przyrodniczej, wynikającej ze zmiany żyzności siedlisk od boru sosnowego przez bór jodłowy do żyznej buczyny. ;;line;no;no;yes;brak;brak;2024-10-14;22.968182;50.60560400000001;Point (780671.83433390781283379 311802.11847169604152441)
P.3.00;DS00699;Urwisko Batorowskie;Krawędź skalna z piaskowca położona na terenie Parku Narodowego Gór Stołowych. Ciągnie się na długości około 4 km.;;line;no;no;yes;Q9367245;pl:Urwisko Batorowskie;2024-10-14;16.433801880186685;50.4306859434492;Point (317802.40469689015299082 287987.68271744064986706)
P1.20;ZP00881;Brzeg klifowy w Trzęsaczu;Brzeg mierzy ok. 20 m wysokości i rozciąga się na długości całej plaży. Największą atrakcją związaną z klifem są ruiny kościoła pochodzące z XIII wieku. Na jego szczycie znajdują się punkty widokowe.;;line;no;no;yes;;;2024-10-14;14.981531244454734;54.0744953730096;Point (237207.75234024995006621 697479.5880339378491044)
K1.20;PM00128;Droga Królewska – ciąg ulic Długiej i Długi Targ;Nieoficjalna nazwa, określająca główną trasę turystyczną w Gdańsku od Bramy Wyżynnej i zespołu przedbramia, przez ulicę Długą na Długi Targ. Nazwa ta ma podobno nawiązywać do uroczystych wjazdów monarchów do miasta, zapoczątkowanych w 1457r. przez Kazimierza Jagiellończyka.;W CKKP oznaczono ciąg komunikacyjny z przebiegiem traktu królewskiego.;line;no;no;yes;Q9210861;pl:Droga Królewska (Gdańsk);2024-10-14;18.646645737075136;54.34992464342325;Point (477039.41431699087843299 720705.65803321730345488)
K1.20;PD00520;Wigierska Kolejka Wąskotorowa;Wąskotorowa kolejka turystyczna o długości 10 km, biegnąca wzdłuż południowego brzegu jeziora Wigry na Suwalszczyźnie, między miejscowościami Płociczno i Krusznik. Kolejka jest cennym zabytkiem techniki oraz jedną z całorocznych atrakcji turystycznych regionu.;;line;no;no;yes;Q9373901;pl:Wigierska Kolej Wąskotorowa;2024-10-14;22.981595474098036;54.02274329858333;Point (760706.19428893772419542 691591.15468308143317699)
P1.30;MA00547;Przełom Dunajca;Przełom rzeki Dunajec przez pasmo górskie Pienin (Pieniny Właściwe) na długości ok. 8 km pomiędzy Sromowcami Niżnymi a Szczawnicą. Rzeka tworzy na tym odcinku wiele zakoli, a ściany skalne osiągają ok. 300 m wysokości. Spływ Pienińskim Przełomem jest atrakcją na skalę europejską.;;line;no;no;yes;Q5314051;pl:Pieniński Przełom Dunajca;2024-10-14;20.4147097;49.3987706;Point (602614.45872956223320216 171106.51368965487927198)
P1.30;PK00548;Przełom Wisłoki;Przełom rzeki na odcinku pomiędzy przysiółkiem Ostryszne, a wsią Myscowa, pomiędzy stromymi, zalesionymi zboczami Kamienia (714 m n.p.m.) i Suchani (580 m n.p.m.).;;line;no;no;yes;brak;brak;2024-10-14;21.538041;49.50529749999999;Point (683689.06707230547908694 185078.88668453972786665)
P2.00;WN00229;Kanał Elbląski;Żeglowna droga wodna na terenie województwa warmińsko-mazurskiego. Jeden z siedmiu cudów Polski.;;line;no;yes;yes;Q5637;pl:Kanał Elbląski;2024-10-14;19.7008776;53.7605512;Point (546191.2391298086149618 655321.1005567405372858)
K1.20;MZ00915;Trakt Królewski w Warszawie;Dawniej szlak komunikacyjny prowadzący ze Starego Miasta w Warszawie w kierunku południowym. Współcześnie ciąg ulic, przy którym znajduje się wiele zabytkowych budowli. Trakt Królewski zaczyna się na placu Zamkowym i biegnie ulicami: Krakowskim Przedmieściem, Nowym Światem, Alejami Ujazdowskimi, Belwederską i Sobieskiego do Wilanowa.;;line;no;yes;no;Q48652;pl:Trakt Królewski w Warszawie;2024-10-14;21.013467312324018;52.247363449884354;Point (637414.14129161601886153 488723.38006908539682627)
K1.20;ZP00828;Mury miejskie w Pyrzycach;Mury obronne z 2. połowy XIII wieku, długości ok. 2000 metrów. W XV w. ich wysokość podwyższono do 7-9 m, rozbudowano przedbramia, baszty i czatownie.;;line;no;no;yes;Q219093;pl:Pyrzyce;2024-10-14;14.8923365;53.1454033;Point (225408.61981027561705559 594560.23582488298416138)
K1.30;WP00854;Średniowieczne mury obronne miasta w Stargardzie;Zespół fortyfikacji otaczających najstarsze części Stargardu. Ich budowę rozpoczęto po otrzymaniu praw miejskich (1243 r.), zachowana do dziś długość obwarowań wynosi ponad kilometr. ;;line;no;yes;no;Q11786741;pl:Mury obronne w Stargardzie;2024-10-14;15.040662445847587;53.33937912764358;Point (236514.91579222190193832 615559.0188816012814641)
S3.10;LU00656;Ścieżka przyrodniczo-dydaktyczna „Dąb Dominik”;Ścieżka przyrodnicza, przebiegająca w województwie lubelskim, na terenie Poleskiego Parku Narodowego. Podstawowa trasa ma długość 2,5 km, dłuższa 3,5 km. Częściowo prowadzona jest kładkami, przystosowanymi do zwiedzania przez osoby niepełnosprawne.;;line;no;no;yes;Q18432190;pl:Ścieżka przyrodnicza „Dąb Dominik”;2024-10-14;23.1167184;51.4579614;Point (785874.73947357456199825 407081.95259989611804485)
K1.30;KP00786;Zespół murów obronnych z zachowanymi basztami i bramami w Toruniu;Zespół średniowiecznych obwarowań Torunia, na które składają się mury odrębnych miast: Starego Miasta Torunia (prawa miejskie 1233 roku), Nowego Miasta Torunia (1264 roku), budowany od połowy XIII w., później modernizowany i rozbudowywany, w XIX w. w większości rozebrany.;;line;no;no;yes;Q11786733;pl:Mury miejskie w Toruniu;2024-10-14;18.6015499;53.009098799999975;Point (473273.57036013755714521 571594.23259327653795481)
S3.10;LU00935;Ścieżka przyrodnicza „Perehod”;Ścieżka dla wielbicieli ptaków, z wieżami obserwacyjnymi oraz schronem ornitologicznym.;;line;no;no;yes;brak;brak;2024-10-14;23.1669868;51.4892592;Point (789165.91149840655270964 410757.19783739373087883)
K1.10;MZ00396;Muzeum Warszawy;Siedziba muzeum mieści się w jedenastu połączonych ze sobą staromiejskich kamienicach – ośmiu po stronie Dekerta na Rynku Starego Miasta i trzech przy ul. Nowomiejskiej. Muzeum gromadzi zbiory z zakresu: archeologii, malarstwa, grafiki, ikonografii, rzeźby, rzemiosła artystycznego, numizmatyki i rysunków architektonicznych. Ich liczba to ok. 300 tys. eksponatów.;;point;no;no;yes;Q202277;pl:Muzeum Warszawy;2024-10-14;21.011426210200522;52.249951331888205;Point (637266.86596663354430348 489007.22350326180458069)
K1.10;MZ00419;Narodowe Muzeum Techniki w Warszawie;Muzeum jest największą placówką muzealnictwa technicznego w Polsce. Rozpoczęło działalność w 1955 r. W ciągu 60 lat działalności zgromadziło cenne zbiory, przede wszystkim z zakresu historii polskiej techniki: kolekcję motocykli, odbiorników radiowych, głównie pochodzących z krajowej produkcji, instrumentów geodezyjnych, przyrządów techniki biurowej, komputerów oraz mechanizmów grających.;;point;no;no;yes;Q6941029;pl:Narodowe Muzeum Techniki w Warszawie;2024-10-14;21.0058739;52.2305729;Point (636947.649600935052149 486842.2805881081148982)
K1.10;MZ00418;Muzeum Sportu i Turystyki w Warszawie;Muzeum poświęcone historii polskiego sportu, jest jedną z najstarszych tego typu placówek w Europie, zostało utworzone w 1952 r. Zgromadzone zbiory obejmują ponad 46 tys. eksponatów, głównie trofeów sportowych (medali, pucharów, dyplomów) oraz proporczyków, sztandarów itp., a także strojów i sprzętu sportowego.;;point;no;no;yes;Q2312270;pl:Muzeum Sportu i Turystyki w Warszawie;2024-10-14;20.9968897;52.27416389999998;Point (636200.71992675436194986 491671.67186219338327646)
K1.10;MZ00393;Muzeum Fryderyka Chopina w Warszawie;Muzeum biograficzne poświęcone Fryderykowi Chopinowi. W zbiorach muzeum znajduje się licząca ok. 7000 obiektów kolekcja chopinianów. Są to m.in. rękopisy, listy oraz inne pamiątki osobiste po kompozytorze, a także fotografie, wizerunki ikonograficzne, obrazy, rysunki i grafiki. Placówka posiada największy na świecie zbiór rękopisów kompozytora.;;point;no;no;yes;Q3692546;pl:Muzeum Fryderyka Chopina w Warszawie;2024-10-14;21.0229197;52.23647329999998;Point (638092.98634503362700343 487530.62035738211125135)
P1.20;MA00882;Smocza Jama w Krakowie;Jaskinia krasowa w obrębie zrębu Wawelu, jedna z turystycznych atrakcji Krakowa. Z jaskinią wiąże się legenda o Smoku Wawelskim. W 1972 r.przed wejściem do niej ustawiono rzeźbę Smok Wawelski autorstwa Bronisława Chromego.;W KKP wzgórze wawelskie było reprezentowane przez jeden obiek, w CKKP rozbito je na kilka.;point;no;no;yes;Q836876;pl:Smocza Jama (Kraków);2024-10-14;19.9336431;50.053143199999994;Point (566817.10917567694559693 243292.78029711358249187)
K1.20;WP00630;Studnia Napoleona;Studnia znajduje się przy dawnym ważnym trakcie handlowym, który wiódł z Poznania na zachód, w kierunku Prus i Francji. Legenda głosi, że Napoleon Bonaparte, podążając z Francji na Moskwę, zatrzymał się w pobliżu i posłał adiutanta po wodę, która okazała się mieć smak szampana.;;point;no;no;yes;Q16607789;pl:Studnia Napoleona;2024-10-14;16.8230976;52.2505056;Point (351443.60953794448869303 489395.30754896532744169)
P1.20;DS00640;Szczeliniec Wielki;Najwyższy szczyt (922 m n.p.m.) w Górach Stołowych, na terenie Parku Narodowego Gór Stołowych. Należy on do Korony Gór Polski oraz Korony Gór Dolnego Śląska i jest jedną z największych atrakcji turystycznych Sudetów, z rezerwatem krajobrazowym i tarasami widokowymi z panoramą Sudetów.;;point;no;no;yes;Q478005;pl:Szczeliniec Wielki;2024-10-14;16.3410065;50.48481429999998;Point (311430.33983778854599223 294235.07812431734055281)
P1.20;PK00665;Tarnica;Najwyższy szczyt polskich Bieszczadów i województwa podkarpackiego, wznoszący się na krańcu pasma połonin, w grupie tzw. gniazda Tarnicy i Halicza.;;point;no;no;yes;Q577655;pl:Tarnica;2024-10-14;22.726323;49.0747705;Point (772035.7037355569191277 140824.56911423522979021)
P1.20;MA00683;Trzy Korony;Najwyższy szczyt Pienin Środkowych należący do Masywu Trzech Koron.;;point;no;no;yes;Q7849064;pl:Trzy Korony (szczyt);2024-10-14;20.4141876;49.41382279999999;Point (602545.23108555376529694 172778.62395406886935234)
P.3.00;PD00840;Turtul – punkt widokowy;Punkt widokowy znajdujący się na krawędzi skarpy doliny Czarnej Hańczy na wysokości 231 m n.p.m. Rozciąga się z niego panorama na dolinę.;;point;no;no;yes;brak;brak;2024-10-14;22.812062;54.222971799999996;Point (748409.11881953396368772 713235.36415051762014627)
P1.20;DS00733;Wodospad Szklarki;Drugi co do wysokości, po Wodospadzie Kamieńczyka (27 m wysokości), wodospad w polskich Karkonoszach, położony na wysokości 525 m n.p.m.;;point;no;no;yes;Q3866644;pl:Wodospad Szklarki;2024-10-14;15.554869500000002;50.829593;Point (257474.43030057896976359 334841.20714600663632154)
P.3.00;PM00747;Wzgórze Rowokół;Wzgórze polodowcowe o wysokości 114,8 m n.p.m. na Wysoczyźnie Damnickiej. W 1984 roku wzgórze Rowokół i jego okolice objęto ochroną w formie rezerwatu przyrody „Rowokół” o powierzchni 562,81 ha, mającego na celu ochronę bukowo-jodłowego lasu na stokach wzgórza moreny czołowej o wysokości dochodzącej do 114,8 m n.p.m.;;point;no;no;yes;Q485633;pl:Rowokół;2024-10-14;17.2098681;54.6558078;Point (384550.58812378905713558 756144.801710763014853)
K1.10;WN00057;Izba Historii Kanału Elbląskiego w Buczyńcu;Zwiedzający mogą się zapoznać z historią powstania kanału oraz zmian dokonanych podczas jego rewitalizacji.;;point;no;no;yes;brak;brak;2024-10-14;19.6188357;53.97762389999999;Point (540573.72502258804161102 679414.28177907597273588)
P1.20;DS00254;Jaskinia Niedźwiedzia;Najdłuższa jaskinia całych Sudetów, położona w Masywie Śnieżnika, w dolinie Kleśnicy, w pobliżu wsi Kletno. Partie środkowe (około 700 m) są dostępne dla turystów od 1983 roku, a ich największą atrakcją są nacieki wewnątrz jaskini.;;point;no;no;yes;Q11721247;pl:Jaskinia Niedźwiedzia (Sudety);2024-10-14;16.842833;50.23449109999999;Point (346208.14059173467103392 265258.80357807781547308)
P1.20;SK00208;Jaskinia Raj;Udostępniona dla ruchu turystycznego wapienna jaskinia krasowa, obok Jaskini Niedźwiedziej w Sudetach należy do unikatowych w Polsce obiektów krasowych. Wyróżnia się wyjątkowo bogatą, różnorodną i dobrze zachowaną szatą naciekową.;;point;no;no;yes;Q2674737;pl:Raj (jaskinia);2024-10-14;20.4990103;50.825156799999995;Point (605545.67321693734265864 329762.60812781564891338)
P1.20;WP00157;Kamień św. Jadwigi w Gołuchowie;Nazywany także Kamieniem św. Kingi - największy w Wielkopolsce, szósty co do wielkości w Polsce, głaz narzutowy. Głaz ma w obwodzie 22 m, długi jest na 8,5 m, szeroki na 6,5 m i wysokość 3,5 m.;Zmieniono nazwe na poprawną;point;no;no;yes;Q11734482;pl:Kamień św. Jadwigi;2024-10-14;17.9468567;51.8253467;Point (427442.85788771929219365 440414.13326248805969954)
P1.20;MA00235;Kasprowy Wierch;"Kasprowy Wierch (słow. Kasprov vrch; dawniej Kasprowa Czuba, Stawiańska Czuba, Goryczkowiańska Czuba) – szczyt w Tatrach Zachodnich o wysokości 1987 m.";;point;no;no;yes;Q1735189;pl:Kasprowy Wierch;2024-10-14;19.9815609;49.2318014;Point (571438.1286589129595086 152051.40412954334169626)
P1.20;ZP00243;Kawcza Góra;Nadmorskie wzniesienie o wysokości 61 m n.p.m. w Paśmie Wolińskim, na wyspie Wolin, nad Zatoką Pomorską, na obszarze Wolińskiego Parku Narodowego.;;point;no;no;yes;Q11737553;pl:Kawcza;2024-10-14;14.4660298;53.9396264;Point (202555.16690633492544293 684533.05193594750016928)
P2.00;MA00273;Kopiec Kościuszki;Poświęcony Tadeuszowi Kościuszce znajduje się na Górze św. Bronisławy w zachodniej części Krakowa na terenie Dzielnicy VII Zwierzyniec.;;point;no;yes;yes;Q641398;pl:Kopiec Kościuszki w Krakowie;2024-10-14;19.8933483;50.054916299999995;Point (563931.05690212920308113 243454.60992983169853687)
P2.00;MA00275;Kopiec Piłsudskiego;Kopiec-pomnik walki narodu o niepodległość, poświęcony Józefowi Piłsudzkiemu. Najwyższy z pięciu istniejących w Krakowie kopców, usypany na szczycie Sowińca (najwyższego wzniesienia Pasma Sowińca) znajdującego się w Lesie Wolskim, w zachodniej części Krakowa na terenie dzielnicy Zwierzyniec. Największy kopiec w Polsce.;;point;no;no;yes;Q1985405;pl:Kopiec Józefa Piłsudskiego w Krakowie;2024-10-14;19.8471648;50.0600489;Point (560619.58338893612381071 243986.61068508587777615)
P2.00;PK00276;Kopiec Tatarski;Kopiec położony na Zniesieniu (350,3 m n.p.m.) w Przemyślu. Pierwotnie miejsce kultu bogów słowiańskich (szczególnie Swarożyca).;;point;no;no;yes;Q11743506;pl:Kopiec Tatarski w Przemyślu;2024-10-14;22.7723488;49.77037439999999;Point (771524.74210959125775844 218274.60892975423485041)
P1.10;MA00325;Kudłoń;Czwarty (1274 m.n.p.m.) co do wysokości szczyt w Gorcach, położony na północny wschód od Turbacza, w grzbiecie łączącym Turbacz z Beskidem Wyspowym.;;point;no;no;yes;Q11750776;pl:Kudłoń;2024-10-14;20.1759613;49.572578099999994;Point (584996.05605627980548888 190125.77221392374485731)
P1.10;SK00363;Łysica;Najwyższy szczyt Gór Świętokrzyskich o wysokości 614 m n.p.m.;;point;no;no;yes;Q384265;pl:Łysica (Góry Świętokrzyskie);2024-10-14;20.8965979;50.891616199999994;Point (633348.3426239425316453 337793.14811450615525246)
P1.10;SK00014;Dąb „Bartek”;Jeden z najstarszych dębów w Polsce, od 1954 roku chroniony prawem jako pomnik przyrody, jego wiek szcuje się na ponad 650 lat.;;point;no;no;yes;Q790880;pl:Dąb Bartek;2024-10-14;20.6500692;50.9875642;Point (615777.57720037479884923 348042.32124840375036001)
P.3.00;PD00179;Cisowa Góra w Gulbieniszkach;Zwana także Suwalską Fudżi-jamą. Wzniesienie utworzone przez morenę czołową. Wznosi się na wysokość 256 m n.p.m. Wzniesienie ma charakterystyczny kształt przypominający stożek krateru wulkanu.;;point;no;no;yes;Q9283391;pl:Góra Cisowa;2024-10-14;22.9097723;54.251370699999995;Point (754598.16207408462651074 716740.33647769503295422)
P1.10;PM00118;Dąb „Bartuś”;Dąb posiada obwód 670 cm i wysokość około 25 metrów. Jego wiek oceniany jest na 600 lat.;;point;no;no;yes;Q26248702;pl:Dąb Bartuś;2024-10-14;17.5324626;53.817465;Point (403415.44168023590464145 662421.82769262045621872)
P1.10;LU00196;Dąb „Bolko” w Hniszowie;Dąb szypułkowy, który według pomiarów z 1992r. skiełkował około 1370 r., tj. ma ok. 650 lat. Jego obwód w pierwszej dekadzie XXI wieku wynosił 870 cm, co stawia go w szeregu największych dębów w Polsce. Osiąga wysokość 29 m.;;point;no;no;yes;Q891397;pl:Dąb Bolko;2024-10-14;23.6982808;51.25680010000001;Point (827675.30513558757957071 387167.54890179168432951)
P1.10;LB00515;Dąb „Chrobry” w Piotrowicach;Dąb Chrobry – dąb szypułkowy, jeden z najstarszych dębów w Polsce, pomnik przyrody. Od 2020 roku drzewo nie wydaje liści i uznane zostało za martwe.;;point;no;no;yes;Q1087503;pl:Dąb Chrobry;2024-10-14;15.7118325;51.52158409999999;Point (271963.77077431476209313 411241.55447523854672909)
P1.10;WN00221;Dąb Jana Bażyńskiego w Kadynach;Dąb szypułkowy, pomnik przyrody, rośnie w miejscowości Kadyny nad Zalewem Wiślanym. Jedno z najstarszych drzew w Polsce (ok. 720 lat). Wymiary (stan na 2015 rok), obwód 1003 cm, wysokość 21 metrów.;;point;no;no;yes;Q812618;pl:Dąb Bażyńskiego;2024-10-14;19.487414300000005;54.2958265;Point (531713.19056865479797125 714740.1603442681953311)
K1.20;MA00702;Dom Jana Pawła II w Wadowicach;Domu rodzinnym papieża Jana Pawła II przy ulicy Kościelnej 7 obok Bazyliki Ofiarowania NMP, w którym znajduje sie muzeum poświęcone życiu i działalności kapłańskiej oraz związków papieża z Wadowicami.;;point;no;no;yes;Q5885537);pl:Dom Rodzinny Ojca Świętego Jana Pawła II w Wadowicach;2024-10-14;19.4939096;49.88336830000001;Point (535471.89213938103057444 224121.74742269050329924)
K1.30;ZP00163;Pomnik bitwy z 972 r. na Górze Czcibora;Wzniesienie morenowe w paśmie Karpat Cedyńskich o wysokości 54,5 metra n.p.m. Na szczyt prowadzą 270-stopniowe, kamienne schody. Nazwa pochodzi od imienia Czcibora, brata Mieszka I, który w bitwie pod Cedynią dowodził jedną trzecią wojsk. W tysięczną rocznicę bitwy (1972 r.) wzniesienie zostało zwieńczone 15-metrowym „Pomnikiem Polskiego Zwycięstwa nad Odrą” przedstawiającym stylizowanego orła wzbijającego się do lotu autorstwa Czesława Wronki i Stanisława Biżka.;;point;no;no;yes;Q9283394;pl:Góra Czcibora;2024-10-14;14.157389400000001;52.85487319999999;Point (174124.95724997622892261 565357.67588061280548573)
P.3.00;LD00509;Pomnik geometrycznego środka Polski w Piątku;Punkt będący środkiem masy (centroidem) figury geometrycznej o kształcie i rozmiarach granic administracyjnych Polski.;;point;no;no;yes;Q11699629;pl:Geometryczny środek Polski;2024-10-14;19.4802296;52.06933539999999;Point (532907.09255403932183981 467127.39700388163328171)
K1.30;SL00242;Pomnik Powstańców Śląskich w Katowicach;Pomnik upamiętniający trzy wystąpienia zbrojne ludności śląskiej przeciwko władzom niemieckim, mające na celu wywalczenie przyłączenia Górnego Śląska do Polski.;;point;no;no;yes;Q7514824;pl:Pomnik Powstańców Śląskich;2024-10-14;19.0240203;50.26358110000001;Point (501711.52076625684276223 266266.74973233416676521)
P1.10;ZP00082;Platan „Olbrzym” w Chojnach;Najokazalszy w Polsce platan klonolistny i jedno z najgrubszych drzew w kraju, jego wiek szacuje się na około 300 lat. ;;point;no;no;yes;Q21856069;pl:Platan Olbrzym;2024-10-14;14.4299481;52.9663234;Point (193244.99857766780769452 576537.99637913331389427)
K1.20;WP00164;Góra Przemysła;Nieznacznie wyniesiona część Starego Miasta w Poznaniu znajdująca się na zachód od Starego Rynku. Za Górę Przemysła uważa się teren pomiędzy ulicami: 23 Lutego, Ludgardy, Muzeum Narodowym i Alejami Marcinkowskiego. Na wzniesieniu tym znajduje się nowo odbudowany Zamek Królewski – dawna rezydencja króla Przemysła II.;;point;no;no;yes;Q9283490;pl:Góra Przemysła;2024-10-14;16.9306289;52.4092281;Point (359285.65412772365380079 506826.58255082275718451)
P1.20;DS00166;Góra Ślęża;Ślęża - najwyższy szczyt Masywu Ślęży i całego Przedgórza Sudeckiego, wznoszący się na wysokość 717,5 m n.p.m. Mimo niewielkiej wysokości bezwzględnej masyw ma imponujący wygląd ze względu na znaczną wysokość względną ponad 500 m. Ślęża należy do Korony Gór Polski, Korony Sudetów Polskich, Korony Sudetów oraz Korony Gór Dolnego Śląska.;;point;no;no;yes;Q387148;pl:Ślęża;2024-10-14;16.707496300000003;50.8640875;Point (338723.5561840555164963 335523.21301916055381298)
P1.20;PD00648;Góra Zamkowa w Szurpiłach;Góra Zamkowa - wzniesienie na Pojezierzu Suwalskim. Położone jest pomiędzy jeziorami: Szurpiły (od południa), Jegłówek (od północy) i Kluczysko (od zachodu). Wierzchołek góry znajduje się na wysokości 45 metrów ponad powierzchnią otaczających ją jezior, na wysokości bezwzględnej 228 m n.p.m. Na wzniesieniu znajdują się pozostałośc osady warownej Jaćwingów. Góra Zamkowa jest jednym z najciekawszych zabytków budownictwa obronnego oraz najważniejszym stanowiskiem archeologicznym na Suwalszczyźnie.;;point;no;no;yes;Q9283545;pl:Góra Zamkowa (Pojezierze Wschodniosuwalskie);2024-10-14;22.8844998;54.234110199999996;Point (753058.97578618791885674 714730.88091302756220102)
P1.20;MA00177;Grota Łokietka;Jaskinia krasowa o rozwinięciu poziomym w Dolinie Sąspowskiej w północno-zachodnim zboczu Chełmowej Góry w obrębie Ojcowskiego Parku Narodowego, udostępniona dla ruchu turystycznego.;;point;no;no;yes;Q11721307;pl:Jaskinia Łokietka;2024-10-14;19.8188973;50.201632799999985;Point (558424.25967710069380701 259701.35437607020139694)
