K1.10;SK00833;Muzeum Wsi Kieleckiej w Tokarni;Skansen powstał z inicjatywy i w zgodzie z założeniami profesora Romana Reinfussa, etnografa i znawcy kultury ludowej Kielecczyzny. Muzeum na powierzchni 65 hektarów skupia 38 zespołów obiektów, które rozmieszczono w pięciu sektorach: małomiasteczkowym, wyżynnym, dworsko-folwarcznym, budownictwa świętokrzyskiego i terenów lessowych.;o. Muzeum Wsi Kieleckiej w Kielcach;area;no;no;yes;Q98181474;pl:Park Etnograficzny w Tokarni;2024-10-14;20.435467764556634;50.76426789630062;Point (601203.2475141923641786 322905.39394201140385121)
K1.10;LU00425;Muzeum Wsi Lubelskiej w Lublinie;Skansen, na terenie którego znajdują się zabytki architektury drewnianej, murowanej i zbiory etnograficzne z rejonu dawnego województwa lubelskiego, Zajmuje tereny o powierzchni ok. 27 ha.;;area;no;no;yes;Q11787254;pl:Muzeum Wsi Lubelskiej w Lublinie;2024-10-14;22.50645108897014;51.25949629662973;Point (744564.8064481153851375 382818.57812208641553298)
K1.10;MZ00605;Muzeum Wsi Mazowieckiej w Sierpcu;"Muzeum w formie skansenu, powołano w 1975 r. terenie obejmującym 60,5 ha. Zgromadzono w nim ponad 80 obiektów małej i dużej architektury. W skład ekspozycji wchodzi: 11 zagród chłopskich z przełomu XIX i XX wieku; zrekonstruowany dworek szlachecki; XVIII-wieczny kościół drewniany z miejscowości Drążdżewo; drewniany wiatrak reprezentujący najstarszy i najpopularniejszy na terenach Europy typ młynów wiatrowych, koźlak; wystawy stałe w Galerii rzeźby ludowej i Powozowni. Obecnie w Muzeum zgromadzonych jest ponad 13 000 eksponatów.";;area;no;no;yes;Q11787256;pl:Muzeum Wsi Mazowieckiej w Sierpcu;2024-10-14;19.636815876631182;52.86501009524564;Point (542857.01906302268616855 555686.18025458487682045)
K1.10;OP00478;Muzeum Wsi Opolskiej w Opolu - Bierkowicach;Zostało utworzone w 1961 r. Espozycję stanowią przeniesione i odbudowane obiekty architektury wiejskiej ilustrujące warunki życia ludności wiejskiej w okresie od XVIII do początków XX wieku: budynki mieszkalne, stodoły, spichlerze, a także młyny i wiatraki, kuźnia, kościół, karczma i szkoła. Muzeum posiada również kolekcję prawie 7000 muzealiów z zakresu kultury materialnej obejmująca zabytkowe przedmioty z dziedziny gospodarki rolniczej, hodowlanej, rzemiosła i życia codziennego mieszkańców wsi opolskiej. Poza sezonem turystycznym muzeum udostępnia do zwiedzania jedynie tereny parkowe, bez wnętrz budynków i stałych wystaw.;;area;no;no;yes;Q212560;pl:Muzeum Wsi Opolskiej w Opolu;2024-10-14;17.861343377049533;50.683412961627546;Point (419583.60317583871074021 313553.3560726068681106)
K1.10;MZ00559;Muzeum Wsi Radomskiej w Radomiu;W muzeum obszarze 32 ha zgromadzono ponad 60 obiektów architektury ludowej, głównie drewnianej. Prezentuje kulturę oraz budownictwo regionu radomskiego. Wśród unikatowych zbiorów znajdują się także współcześnie zrekonstruowane zabudowania.;;area;no;no;yes;Q11787255;pl:Muzeum Wsi Radomskiej w Radomiu;2024-10-14;21.0808991028562;51.36467905387496;Point (644817.7893243576399982 390726.67397733323741704)
K1.10;PM00255;Muzeum Wsi Słowińskiej w Klukach;Placówka zapoczątkowała swoją działalność w 1963 roku, organizując w jednej z zagród, zbudowanej w połowie XIX wieku i zachowanej w miejscu pierwotnej lokalizacji stałą ekspozycję prezentującą kulturę Słowińców – ludności zamieszkałej niegdyś nad jeziorami Gardno i Łebsko.;;area;no;no;yes;Q3501614;pl:Muzeum Wsi Słowińskiej;2024-10-14;17.334650520061054;54.68200120498397;Point (392666.39745125221088529 758860.15106670127715915)
K1.10;SK00601;Muzeum Zagłębia Staropolskiego w Sielpi Wielkiej;Muzeum obejmuje zespół dawnych zabudowań przemysłowych z XIX w wraz z urządzeniami walcowniczymi i hutniczymi. Do najcenniejszych eksponatów należą: 8-metrowe koło wodne, wykonane według projektu Filipa de Girarda oraz około 30 maszyn z przełomu XVIII i XIX wieku, takich jak tokarki, strugarki, prasy, wiertarki i obrabiarki. W ramach ekspozycji plenerowej prezentowane jest koło wodne wraz z młotem, pochodzące z XVI-wiecznej kuźni.;;area;no;no;yes;Q17619168;pl:Muzeum Zagłębia Staropolskiego w Sielpi;2024-10-14;20.347495079377445;51.11478614984447;Point (594289.55650324746966362 361753.34815025690477341)
K1.10;PM00852;Muzeum Zalewu Wiślanego;Muzeum na swoich wystawach prezentuje historię szkutnictwa i rybołówstwa nad Zalewem Wiślanym. Wśród eksponatów muzeum jest oryginalny, w pełni wyposażony warsztat szkutniczy rodziny Schmidtów z miejscowości Łaszka k. Sztutowa oraz barkas - jednostka o napędzie żaglowym wykorzystywana do połowów jeszcze w latach 60. XX wieku.;o. Narodowego Muzeum Morskiego w Gdańsku W KKP Narodowe Muzeum Morskie w Gdańsku, było oznaczone jako jeden obiekt w CKKP zostało rozdzielone na poszczególne obiekty.;area;no;no;yes;Q11787265;pl:Muzeum Zalewu Wiślanego;2024-10-14;19.23690227863192;54.34107403918518;Point (515396.98382504965411499 719689.5043923903722316)
K1.10;WP00639;Muzeum Zamek Górków w Szamotułach;Kompleks składa sie z zamku wraz z Basztą Halszki i budynkami pomocniczymi (oficyny i bażanciarnia), położonymi w zabytkowym parku. Na zamku od 1551 r. działała pierwsza w historii wielkopolska drukarnia, która wydawała książki w języku polskim i czeskim. Budynek jest siedzibą muzeum, w którym prezentuje się zabytkowe wnętrza, regionalne zbiory archeologiczne i etnograficzne oraz historię rodu Górków.;;area;no;no;yes;Q16619092;pl:Zamek w Szamotułach;2024-10-14;16.577490134144924;52.61509981154771;Point (336044.40991166030289605 530460.19312741374596953)
K1.10;WP00604;Muzeum Zamek Opalińskich w Sierakowie;"Początki zamku sięgają końca XIV wieku. Wielokrotnie przebudowywany w końcu w 1829 r. w związku z budową nowej drogi pozostałości zamku zostały rozebrane. W 1991 r. rozpoczęto prace budowlano-badawcze mające na celu odrestaurowanie trwały dwa lata. Z braku źródeł o wyglądzie zamku postanowiono dokonać jedynie ""restytucji"" skrzydła południowego poprzez nadbudowę zachowanych piwnic i nakrycie budynku wysokim krytym dachówką dachem. W odrestaurowanym budynku działa od 1995 r. muzeum prezentujące dzieje Ziemi Sierakowskiej od czasów najdawniejszych po współczesność.";;area;no;no;yes;Q11787267;pl:Muzeum Zamek Opalińskich;2024-10-14;16.08453020046618;52.65144089719123;Point (302851.29297348385443911 535735.54285824461840093)
K1.10;MA00120;Muzeum Zamkowe w Dębnie;Muzeum jest oddziałem Muzeum Ziemi Tarnowskiej w Tarnowie. Od 1978 r. miesci się w późnogotyckim zamamku wzniesiony w latach 1470–1480 dla kanclerza wielkiego koronnego Jakuba z Dębna, na planie nieregularnego czworoboku.;;area;no;no;yes;Q5321022;pl:Zamek w Dębnie;2024-10-14;20.715516119523215;49.964214396619596;Point (622997.18235458433628082 234400.86107296813861467)
K1.10;WP00158;Muzeum Zamkowe w Gołuchowie;Wczesnorenesansowa murowana budowla o charakterze obronnym, kilkukondygnacyjna, na planie prostokąta, z basztami w każdym z narożników, która została wzniesiona w latach 1550–1560. Przebudowana w drugiej połowie XIX w. przez Izabellę z Czartoryskich Działyńską. Obecnie w zamku mieści się oddział Muzeum Narodowego w Poznaniu z ekspozycją zabytkowych wnętrz i dzieł sztuki.;;area;no;no;yes;Q9386639;pl:Zamek w Gołuchowie;2024-10-14;17.93385072824042;51.85259783293589;Point (426591.1596380184055306 443456.99409547954564914)
K1.10;PM00364;Muzeum Zamkowe w Malborku;Muzeum o charakterze historyczno-artystycznym oraz placówka kulturalno-naukowa powołana dnia 1 stycznia 1961 roku. Mieści się w historycznym największym na świecie ceglanym zamku krzyżackim w Malborku, w którym zgromadzono ponad 40 tys. muzealiów, głównie dzieł rzeźby, malarstwa i rzemiosła artystycznego.;;area;yes;yes;yes;Q11787266;pl:Muzeum Zamkowe w Malborku;2024-10-14;19.02776358494833;54.040001526613864;Point (501817.59945644158869982 686175.51178503839764744)
K1.10;LU00308;Muzeum Zamoyskich w Kozłówce;Muzeum mieści się w pałacu rodziny Zamoyskich zbudowanym w latach 1736–1742. We wnętrzach pałacu, które zachowały autentyczny wystrój z przełomu XIX wieku i XX wieku w tym: neobarokowe i neoregencyjne plafony, piece z miśnieńskich kafli, marmurowe kominki, dębowe parkiety, zgromadzona jest również niezwykła kolekcja malarstwa, mebli, rzeźb, luster, kobierców, porcelany, złoconych brązów i sreber. W ramach muzeum działa również Galeria Socrealizmu, prezentującą dzieła związane z realizmem socjalistycznym.;W PH obiekt jest oznaczony jako Zespół pałacowo - parkowy. W CKKP jest oznaczony jako muzeum. ;area;no;yes;yes;Q110386531;pl:Muzeum Zamoyskich w Kozłówce;2024-10-14;22.489453311209935;51.459596798921844;Point (742320.43334547337144613 404999.61480648105498403)
K1.10;LD00430;Muzeum Zespół Opactwa Cystersów w Sulejowie;"Jeden z najlepiej zachowanych zespołów cysterskich w Polsce, będący zabytkiem architektury romańskiej. Z klasztoru zachowało się skrzydło wsch. z kapitularzem póżnoromańskim, wspartym na centralnej kolumnie i gotyckim krużgankiem. Z dawnego pałacu opatów została jedna ściana. Zachowały się również budynki gospodarcze z XV-XVI w. i XVII w.; dawny arsenał z XVI-XVI w. Obecnie część zabudowań zajmuje hotel Best Western Podklasztorze oraz restauracja Miód i Wino.";;area;no;yes;yes;Q1480940;pl:Opactwo Cystersów w Sulejowie;2024-10-14;19.879400106531673;51.36451944483166;Point (561203.48246816068422049 389021.20881117857061327)
K1.30;MZ00493;Muzeum-Miejsce Pamięci w Palmirach;Miejsce pamięci narodowej z grobami przeszło 2 tysięcy Polaków, zamordowanych przez Niemców w czasie II wojny światowej.;;area;no;no;yes;Q559257;pl:Cmentarz w Palmirach;2024-10-14;20.74536984071705;52.33205004134871;Point (618891.69671685597859323 497664.33554287062725052)
K1.10;PK00349;Muzeum-Zamek w Łańcucie;Muzeum powstałe w 1944 r. z siedzibą w Zamku w Łańcucie, który jest jedną z najpiękniejszych rezydencji arystokratycznych w Polsce. Słynie ze znakomitych wnętrz mieszkalnych oraz niezwykle interesującej kolekcji pojazdów konnych. Zespół pałacowy otacza stary, malowniczy park w stylu angielskim, w którym wznoszą się liczne pawilony i zabudowania gospodarcze, ściśle niegdyś związane z codziennym życiem łańcuckiej rezydencji.;;area;no;yes;yes;Q110388042;pl:Muzeum – Zamek w Łańcucie;2024-10-14;22.234572341342346;50.06846139097779;Point (731391.9599279526155442 249588.92509789462201297)
K1.10;MZ00808;Muzeum-Dom Fryderyka Chopina w Żelazowej Woli;Muzeum biograficzne Fryderyka Chopina oraz 7-hektarowy park krajobrazowy. Mieści się w dworku zbudowanym około 1800 r.;;area;no;no;yes;Q4917089;pl:Dom Urodzenia Fryderyka Chopina;2024-10-14;20.31124701621963;52.25682531491139;Point (589472.95791345310863107 488675.76543418713845313)
K1.10;MZ00613;Muzeum Ziemi Sochaczewskiej i Pola Bitwy nad Bzurą w Sochaczewie;Mieści się w klasycystycznym budynku ratusza w Sochaczewie z lat 30. XIX w W muzeum znajdują się wystawy stałe: „Pole bitwy 1939–1945” – „Gdy bój nad Bzurą wrzał...”, „Nad Bzurą bez zmian” , „Archeologia Ziemi Sochaczewskiej”.;;area;no;no;yes;Q11787284;pl:Muzeum Ziemi Sochaczewskiej i Pola Bitwy nad Bzurą;2024-10-14;20.237082508637133;52.230041939874894;Point (584463.38728777365759015 485608.78221369825769216)
K1.10;LB00801;Muzeum Ziemi Lubuskiej w Zielonej Górze;Muzeum gromadzi i chroni materialne i duchowe dziedzictwo kulturowe ziem położonych nad środkową Odrą. W swoich zbiorach zgromadziło ponad 17 tysięcy obiektów.;;area;no;no;yes;Q11787278;pl:Muzeum Ziemi Lubuskiej w Zielonej Górze;2024-10-14;15.508743582387972;51.94162739873172;Point (260119.32061556578264572 458576.50920234963996336)
K1.10;WP00224;Muzeum Ziemi Kaliskiej w Kaliszu;Muzeum założone w 1906 r. jako Muzeum Archeologiczne. Jedno z najstarszych muzeów regionalnych w Polsce, dokumentuje historię Kalisza i Kaliskiego (wschodniej Wielkopolski).;;area;no;no;yes;Q11787107;pl:Muzeum Okręgowe Ziemi Kaliskiej w Kaliszu;2024-10-14;18.082134866698116;51.7607158712504;Point (436672.29023662564577535 433102.30278478597756475)
K1.10;DS00256;Muzeum Ziemi Kłodzkiej w Kłodzku;Powstała w 1963 r. placówka muzealna i naukowa obejmująca swoim zainteresowaniem teren ziemi kłodzkiej i jej wielonarodową spuściznę kulturową, a tym geologię, geografię, historię, historię kultury materialnej i sztuki regionu. Siedzibą muzeum jest dawny konwikt jezuicki w Kłodzku.;;area;no;no;yes;Q11787277;pl:Muzeum Ziemi Kłodzkiej w Kłodzku;2024-10-14;16.65145544687683;50.438192236023696;Point (333280.27321961149573326 288310.78500166937010363)
P2.00;PM00186;Fokarium na Helu – Stacja Morska Instytutu Oceanografii Uniwersytetu Gdańskiego;Fokarium składa się z kompleksu trzech basenów hodowlanych, kilku małych basenów-separatek (dla osobników młodych i chorych wymagających rehabilitacji) i budynku dydaktyczno-laboratoryjnego z salą seminaryjną i laboratoriami. Placówka prowadzi działalność naukową, której celem jest odtworzenie kolonii foki szarej w akwenie południowego Bałtyku. Jest jedną z największych atrakcji turystycznych Helu.;;area;no;no;yes;Q7440540;pl:Fokarium w Helu;2024-10-14;18.800052049352942;54.60695091355228;Point (487088.78187381295720115 749257.05792004731483757)
K1.10;KP00909;Exploseum w Bydgoszczy;Placówka muzealna, prezentująca architekturę przemysłową III Rzeszy na obszarze DAG Fabrik Bromberg (jednego z największych przedsiębiorstw zbrojeniowych III Rzeszy wzniesionego na okupowanych ziemiach polskich), wraz z podziemną trasą turystyczną. Ekspozycje dotyczą historii koncernu DAG, którego założycielem był Alfred Nobel, fabryki DAG Bromberg, wojskowości, uzbrojenia, materiałów wybuchowych, a także pracy przymusowej na terenach III Rzeszy, ruchu oporu, konspiracji i sabotażu.;fo Muzeum Okręgowe im. Leona Wyczółkowskiego w Bydgoszczy. Muzeum było potraktowane jako jeden obiekt, w CKKP zostały wprowadzone poszczególne oddziały.;area;no;no;yes;Q9257141;pl:Exploseum w Bydgoszczy;2024-10-14;18.075361216765003;53.07155054036115;Point (438069.11795902863377705 578864.69287708157207817)
K1.10;MA00831;Fabryka Schindlera - Oddział Muzeum Historycznego m. Krakowa;Fabryka Emalia Oskara Schindlera – oddział Muzeum Historycznego Miasta Krakowa, dawna fabryka założona w 1937r. w Krakowie, jako Fabryka Naczyń Emaliowanych i Wyrobów Blaszanych „Rekord”, której jednym z założycieli był przedsiębiorca związany wcześniej z olkuską Emalią, Wolf Luzer Glajtman. Wydzierżawiona, a potem przejęta przez niemieckiego przedsiębiorcę Oskara Schindlera w 1939r. jako Niemiecka Fabryka Wyrobów Emaliowanych – Deutsche Emailwarenfabrik (DEF), prowadzona przez Schindlera do roku 1945. Fabryka mieści się przy ulicy Lipowej 4, na krakowskim Zabłociu.;;area;no;no;yes;Q286522;pl:Fabryka Emalia Oskara Schindlera;2024-10-14;19.961621005519323;50.047462204905074;Point (568827.46893859771080315 242686.73089946777326986)
K1.20;PK01009;Dworek opacki w Koprzywnicy;Dawny dom przeora wchodzący w skład Opactwo Cystersów w Koprzywnicy. Wzniesiony w latach 1615–1620 Znajduje się tuż obok kościoła świętego Floriana. Znany pod nazwą dworu opackiego, mimo iż rzeczywisty dom opacki usytuowany był w innym miejscu i nie zachował się. Stylem nawiązuje do dawnych dworków szlacheckich.;Obiekty wchodzące w skład Opactwo Cystersów w Koprzywnicy zostały rozdzielone.;area;no;no;yes;Q33509800;pl:Dworek opacki w Koprzywnicy;2024-10-14;21.574532859011907;50.59440620088249;Point (682157.84935458225663751 306203.97193289449205622)
K1.10;ZP00910;Gmach Główny Muzeum Narodowego w Szczecinie;W budynku muzeum eksponowane są zbiory archeologiczne, etnograficzne (kolekcja afrykańska). Z dostępnej dla turystów wieży rozciąga się widok na Szczecin i okolice, szczególnie Międzyodrze. Gmach główny Muzeum Narodowego w Szczecinie mieści się na Wałach Chrobrego.;;area;no;no;yes;;pl:Gmach Główny Muzeum Narodowego w Szczecinie;2024-10-14;14.56474763903495;53.43009960710373;Point (205488.6947391027060803 627503.31058657204266638)
K1.40;SL00110;Zespół klasztoru oo. Paulinów na Jasnej Górze w Częstochowie;Sanktuarium wraz z klasztorem zakonu paulinów w Częstochowie położone na wzgórzu o tej samej nazwie. Jedno z ważniejszych miejsc kultu maryjnego oraz najważniejsze centrum pielgrzymkowe katolików w Polsce ze znajdującym się obrazem Matki Bożej Częstochowskiej, który uważany jest za cudowny, oraz zbiorem wielu innych dzieł sztuki, najczęściej sakralnej, stanowiących w większości dary wotywne wiernych.;;area;no;yes;yes;Q573920;pl:Jasna Góra;2024-10-14;19.09708248051855;50.81256499757362;Point (506837.59523060801438987 327296.86384488275507465)
K1.40;PK00225;Zespół klasztorny Franciszkanów z kalwarią w Kalwarii Pacławskiej;Obecnie sanktuarium Męki Pańskiej i Matki Bożej Kalwaryjskiej. Na szczycie góry o wysokości 465 m n.p.m. znajduje się klasztor franciszkanów, bazylika oraz dom pielgrzyma.;Ze wzgledu na rozmiar granice zespołu klasztornego są tożsame z granicami wsi.;area;no;no;yes;Q2131857;pl:Kalwaria Pacławska;2024-10-14;22.70779235201477;49.63091687720519;Point (767645.02733268472366035 202547.99546603634371422)
K1.40;SL00510;Kalwaria w Piekarach Śląskich;Kalwaria wchodząca w skład Sanktuarium Matki Sprawiedliwości i Miłości Społecznej. Słynaca z pielgrzymek stanowych: niewiast i panien (niedziela po 15 sierpnia) oraz mężczyzn i młodzieży (ostatnia niedziela maja).;W KKP obiekt występował jako Sanktuarium Maryjne z Kalwarią, w CKKP został rozdzielony.;area;no;no;yes;Q30064681;pl:Kalwaria Piekarska;2024-10-14;18.946908119242057;50.381693571525;Point (496226.4025569714140147 279396.89722836803412065)
K1.20;KP00020;Kamienica „Pod Gwiazdą” W Toruniu;Kamienica mieszczańska znajdująca przy Rynku Staromiejskim 35 w Toruniu, wyróżniajaca się późnobarokową fasadą, ozdobioną na szczycie złotą gwiazdą, od której pochodzi jej nazwa.;;area;no;no;yes;Q11734148;pl:Kamienica Pod Gwiazdą w Toruniu;2024-10-14;18.605204993479337;53.0106630635082;Point (473519.69568132027052343 571766.83535962773021311)
K1.10;KP00410;Ratusz Staromiejski w Toruniu;"Gotycki ratusz z elementami późnorenesansowymi, w centrum rynku staromiejskiego. Powstawał stopniowo od poł. XIII w. Mieści się w nim jedno z najstarszych muzeów w Polsce - ""Muzeum Okręgowe w Toruniu"" .";;area;no;no;yes;Q6796021;pl:Ratusz Staromiejski w Toruniu;2024-10-14;18.60436098137455;53.010520159543425;Point (473462.99738275283016264 571751.25522721465677023)
K1.10;PK00589;Muzeum Okręgowe w Rzeszowie;Gmach główny muzeum to dawny budynek klasztorny konwentu Pijarów (1655-1784) wzniesiony w latach 1644-1649 przez Jana Cangera. Rozbudowany i przebudowany w latach 1695-1708 według projektu Tylmana z Gameren. Fasada późnobarokowa. Po kasacji zakonu budynek przeznaczono na cele świeckie. Od 1954 roku siedziba muzeum. Mieszczą się działy: Archeologii, Sztuki, Historii oraz Biblioteka, Administracja i Pracownia Konserwacji Dzieł Sztuki.;;area;no;no;yes;Q11787110;pl:Muzeum Okręgowe w Rzeszowie;2024-10-14;22.001449402550925;50.03527467226395;Point (714866.04596267023589462 245204.53794842326897196)
K1.10;KP00060;Budynek byłej Lecznicy Miejskiej w Bydgoszczy;Siedziba główna muzeum. Znajduje się tam wystawa sztuki współczesnej: OBRAZY NIE-/RZECZYWISTOŚCI. Ekspozycja prezentująca wypowiedzi twórcze, w kontekście zarówno inspiracji panującymi ideami, jak i prób wypracowania własnych dróg artystycznych. Znajdują się na niej prace takich artystów, jak m.in.: Ryszard Winiarski, Henryk Stażewski, Mieczysław Wejman, Andrzej Wróblewski, Teresa Pągowska, Jan Cybis, czy Józef Czapski.;f. Muzeum Okręgowe im. Leona Wyczółkowskiego w Bydgoszczy. Muzeum było potraktowane jako jeden obiekt, w CKKP zostały wprowadzone poszczególne filie.;area;no;no;yes;Q11787109;pl:Muzeum Okręgowe im. Leona Wyczółkowskiego w Bydgoszczy;2024-10-14;18.003162294975738;53.124604204793364;Point (433315.56668153585633263 584829.37764489627443254)
K1.10;KP00900;Dom Leona Wyczółkowskiego w Bydgoszczy;Dawny dom zarządcy młynów, do 1994 r. mieścił Dział Numizmatyki, Dział Grafiki, Dział Inwentaryzacji, Pracownię Konserwacji, Fotograficzną i Plastyczną, od 2009 r. eksponuje się tu dzieła Leona Wyczółkowskiego oraz pamiątki po artyście.;f. Muzeum Okręgowe im. Leona Wyczółkowskiego w Bydgoszczy. Muzeum było potraktowane jako jeden obiekt, w CKKP zostały wprowadzone poszczególne filie.;area;no;no;yes;Q11787109;pl:Muzeum Okręgowe im. Leona Wyczółkowskiego w Bydgoszczy;2024-10-14;17.995150784887457;53.1221285396775;Point (432775.78141900018090382 584561.55846013827249408)
K1.10;KP00901;Europejskie Centrum Pieniądza w Bydgoszczy;Mieści Pracownię Numizmatyki oraz Dział Ewidencji, Digitalizacji i Konserwacji Zbiorów.;f. Muzeum Okręgowe im. Leona Wyczółkowskiego w Bydgoszczy. Muzeum było potraktowane jako jeden obiekt, w CKKP zostały wprowadzone poszczególne filie.;area;no;no;yes;Q11787109;pl:Muzeum Okręgowe im. Leona Wyczółkowskiego w Bydgoszczy;2024-10-14;17.99726987128928;53.12286778148477;Point (432918.69482671417063102 584641.77965238923206925)
K1.10;KP00902;Dom Młynarza w Bydgoszczy;Mieścił sie w nim Dział Etnografii i Oświatowy, a od 1992 r. Dział Archeologii, w 2009 r. zaadaptowany na centrum recepcyjno-informacyjne zespołu muzealnego.;f. Muzeum Okręgowe im. Leona Wyczółkowskiego w Bydgoszczy. Muzeum było potraktowane jako jeden obiekt, w CKKP zostały wprowadzone poszczególne filie.;area;no;no;yes;Q11787109;pl:Muzeum Okręgowe im. Leona Wyczółkowskiego w Bydgoszczy;2024-10-14;17.997210838274082;53.12240270630097;Point (432914.02155682409647852 584590.11582953482866287)
K1.10;ZP00378;Muzeum Wolińskiego Parku Narodowego w Międzyzdrojach;Nowoczesny pawilon otwarty został w 1995 r., z 5 salami o powierzchni całkowitej 900 m². Ekspozycja prezentuje przy pomocy dioramami bogactwo przyrody Wolińskiego PN. Muzealna kolekcja batalionów (130 samców w szacie godowej) uznawana jest za najbogatszą w Polsce.;;area;no;no;yes;Q11787160;pl:Muzeum Przyrodnicze Wolińskiego Parku Narodowego;2024-10-14;14.450077515422702;53.92709429332315;Point (201419.73928062623599544 683207.67224152421113104)
K1.20;SL00692;Browarium w Tychach;Muzeum otwarto w 2004 r. Zgromadzono w nim eksponaty dotyczące tradycji i historii Tyskich Browarów Książęcych oraz kolekcje fotografii, kufli, beczek, butelek, podkładek i wiele innych eksponatów związanych z piwem.;;area;no;no;yes;Q9363737;pl:Muzeum Tyskich Browarów Książęcych;2024-10-14;18.989384570820572;50.1292652918118;Point (499241.49273825011914596 251336.65620550446328707)
K1.10;PK00879;Pałac Mieroszewskich w Będzinie;Udostępnia zwiedzającym dobra kultury i materiały dokumentujące z zakresu historii regionu. W zamku mieszczą się wystawy stałe poświęcone między innymi wnętrzom stylowym wyeksponowanym w reprezentacyjnych wnętrzach pałacu.;;area;no;no;yes;Q11814808;pl:Pałac Mieroszewskich;2024-10-14;19.123833670520032;50.3287595144009;Point (508811.48418004816630855 273518.83391650806879625)
K1.10;PM00845;Ośrodek Kultury Morskiej w Gdańsku;Powstały w 2012 r. oddział Muzeum Morskiego jest centrum edukacji morskiej. Znajdują się tam dwie wystawy stałe: „Ludzie – statki – porty” oraz „Łodzie ludów świata”.;o. Narodowego Muzeum Morskiego w Gdańsku W KKP Narodowe Muzeum Morskie w Gdańsku, było oznaczone jako jeden obiekt w CKKP zostało rozdzielone na poszczególne obiekty.;area;no;no;yes;Q4845346;pl:Narodowe Muzeum Morskie w Gdańsku;2024-10-14;18.657353972343888;54.350850121656784;Point (477735.72167471429565921 720805.16753870982211083)
K1.40;MZ00439;Zespół klasztorny Franciszkanów w Niepokalanowie;Franciszkański klasztor-sanktuarium („Gród Maryi”). Założony w sierpniu 1927 r. na ziemiach ofiarowanych przez księcia Jana Druckiego-Lubeckiego, klasztor niepokalanowski stanowił miejsce działalności świętego o. Maksymiliana Marii Kolbego, franciszkanina.;;area;no;no;yes;Q1283855;pl:Niepokalanów;2024-10-14;20.416050021074312;52.20416952412491;Point (596738.24308781116269529 482955.81817938823951408)
K1.10;PM00907;Nomus – Nowe Muzeum Sztuk;Muzeum sztuki współczesnej w Gdańsku, zlokalizowane na postoczniowych terenach, działające jako oddział Muzeum Narodowego w Gdańsku. Placówka ta jest najmłodszym muzeum sztuki współczesnej w Polsce.;o. Muzeum Narodowego w Gdańsku W KKP wszyskie oddziały muzeum potraktowano jako jeden. W CKKP zostały rozdzielone na poszczególne obiekty.;area;no;no;yes;Q111830692;pl:Nomus – Nowe Muzeum Sztuk;2024-10-14;18.648037779200788;54.36316596903766;Point (477137.22017149085877463 722178.07857425895053893)
P2.00;DS00460;Ogród botaniczny Uniwersytetu Wrocławskiego;Ogród botaniczny założony we Wrocławiu w roku 1811 na terenie częściowo Ostrowa Tumskiego. Jest to drugi, po Ogrodzie Botanicznym Uniwersytetu Jagiellońskiego, najstarszy ogród w Polsce.;;area;no;no;yes;Q3886274;pl:Ogród Botaniczny Uniwersytetu Wrocławskiego;2024-10-14;17.047632258714728;51.11602691621802;Point (363391.69432502309791744 362840.21975591767113656)
P2.00;ZP00147;Ogród Dendrologiczny w Glinnej im. prof. Jerzego Tumiłowicza;Ogród powstał najprawdopodobniej około 1911 r. Znajduje się w nim ponad 800 gatunków i odmian drzew i krzewów, przede wszystkim egzotycznych rozmieszczonych na 6 ha. Najstarszym drzewem na obszarze ogrodu jest orzesznik pięciolistkowy, który ma około 180 lat.;;area;no;no;yes;Q9158896;pl:Ogród Dendrologiczny w Glinnej;2024-10-14;14.718639427651244;53.29744188165456;Point (214816.25530710458406247 612136.48781400208827108)
